{
  "contract_version": "2026-07-16",
  "default_profile": "standard-context",
  "legacy_aliases": {
    "small": "acceptance-small",
    "default": "standard-context",
    "large": "large-context",
    "4096": "legacy-4096"
  },
  "profiles": [
    {
      "profile_name": "acceptance-small",
      "provider": "agentcore",
      "model_id": "acceptance/small-context",
      "client_ids": ["test"],
      "hard_context_limit": 4096,
      "safe_active_context_ceiling": 3072,
      "reserved_output_tokens": 512,
      "reserved_tool_schema_tokens": 128,
      "reserved_tool_result_tokens": 256,
      "safety_reserve_tokens": 128,
      "soft_compaction_threshold_tokens": 2304,
      "hard_compaction_threshold_tokens": 2880,
      "retrieval_page_size": 50,
      "tokenizer": "cl100k_base-estimate",
      "last_validated_date": "2026-07-16",
      "validation_source": "AgentCore bounded acceptance profile; never a production default",
      "production_profile": false
    },
    {
      "profile_name": "legacy-4096",
      "provider": "agentcore",
      "model_id": "legacy/4096-alias",
      "client_ids": [],
      "hard_context_limit": 6144,
      "safe_active_context_ceiling": 4096,
      "reserved_output_tokens": 1024,
      "reserved_tool_schema_tokens": 256,
      "reserved_tool_result_tokens": 512,
      "safety_reserve_tokens": 256,
      "soft_compaction_threshold_tokens": 3072,
      "hard_compaction_threshold_tokens": 3840,
      "retrieval_page_size": 50,
      "tokenizer": "cl100k_base-estimate",
      "last_validated_date": "2026-07-16",
      "validation_source": "Backward-compatible M3 budget alias; not a production ceiling",
      "production_profile": false
    },
    {
      "profile_name": "standard-context",
      "provider": "generic",
      "model_id": "capability/standard-128k",
      "client_ids": ["cursor", "codex", "claude-code", "claude-desktop", "minimax", "mavis", "antigravity", "open-interpreter"],
      "hard_context_limit": 131072,
      "safe_active_context_ceiling": 98304,
      "reserved_output_tokens": 8192,
      "reserved_tool_schema_tokens": 4096,
      "reserved_tool_result_tokens": 8192,
      "safety_reserve_tokens": 4096,
      "soft_compaction_threshold_tokens": 73728,
      "hard_compaction_threshold_tokens": 92160,
      "retrieval_page_size": 200,
      "tokenizer": "provider-reported-or-cl100k-estimate",
      "last_validated_date": "2026-07-16",
      "validation_source": "Capability-class fallback; selected provider/model profile overrides it",
      "production_profile": true
    },
    {
      "profile_name": "large-context",
      "provider": "generic",
      "model_id": "capability/large-256k",
      "client_ids": [],
      "hard_context_limit": 262144,
      "safe_active_context_ceiling": 196608,
      "reserved_output_tokens": 16384,
      "reserved_tool_schema_tokens": 8192,
      "reserved_tool_result_tokens": 16384,
      "safety_reserve_tokens": 8192,
      "soft_compaction_threshold_tokens": 147456,
      "hard_compaction_threshold_tokens": 184320,
      "retrieval_page_size": 500,
      "tokenizer": "provider-reported-or-o200k-estimate",
      "last_validated_date": "2026-07-16",
      "validation_source": "Extensible large-context capability profile",
      "production_profile": true
    },
    {
      "profile_name": "one-million-context",
      "provider": "generic",
      "model_id": "capability/one-million",
      "client_ids": [],
      "hard_context_limit": 1000000,
      "safe_active_context_ceiling": 880000,
      "reserved_output_tokens": 32768,
      "reserved_tool_schema_tokens": 16384,
      "reserved_tool_result_tokens": 32768,
      "safety_reserve_tokens": 32768,
      "soft_compaction_threshold_tokens": 660000,
      "hard_compaction_threshold_tokens": 825000,
      "retrieval_page_size": 1000,
      "tokenizer": "provider-reported-model-tokenizer",
      "last_validated_date": "2026-07-16",
      "validation_source": "One-million-token active-context capability profile; not a durable-memory cap",
      "production_profile": true
    },
    {
      "profile_name": "future-above-million",
      "provider": "generic",
      "model_id": "capability/future-above-million",
      "client_ids": [],
      "hard_context_limit": 2000000,
      "safe_active_context_ceiling": 1750000,
      "reserved_output_tokens": 65536,
      "reserved_tool_schema_tokens": 32768,
      "reserved_tool_result_tokens": 65536,
      "safety_reserve_tokens": 65536,
      "soft_compaction_threshold_tokens": 1312500,
      "hard_compaction_threshold_tokens": 1640625,
      "retrieval_page_size": 2000,
      "tokenizer": "provider-reported-model-tokenizer",
      "last_validated_date": "2026-07-16",
      "validation_source": "Forward-compatibility proof that schema and compiler accept limits above one million",
      "production_profile": false
    }
  ]
}
